{
  "schema": "dolgorae-one-shot-review-observation/v1",
  "request_ref": "018f0000-0000-7000-8000-000000058001",
  "request_sha256": "sha256:aaaaaaaaaaaaaaaaaaaaaaaaaaaaaaaaaaaaaaaaaaaaaaaaaaaaaaaaaaaaaaaa",
  "profile": "reviewer",
  "observation": "known",
  "outcome": "succeeded",
  "result": {
    "schema": "dolgorae-specialist-review-result/v3",
    "operation": "review_target_result",
    "review_id": "018f0000-0000-7000-8000-000000000010",
    "target": {
      "request": {
        "kind": "staged"
      },
      "capture_ref": "018f0000-0000-7000-8000-000000000011",
      "capture_revision": 1,
      "resolved_base": "aaaaaaaaaaaaaaaaaaaaaaaaaaaaaaaaaaaaaaaa",
      "resolved_head": "bbbbbbbbbbbbbbbbbbbbbbbbbbbbbbbbbbbbbbbb",
      "manifest_digest": "cccccccccccccccccccccccccccccccccccccccccccccccccccccccccccccccc",
      "whole_target_digest": "dddddddddddddddddddddddddddddddddddddddddddddddddddddddddddddddd",
      "capture_integrity": "verified"
    },
    "reviewer": {
      "profile": "reviewer",
      "run_id": "018f0000-0000-7000-8000-000000000012",
      "state": "closed",
      "model": "gpt-5",
      "effort": "high",
      "executable": {
        "version": "0.157.1",
        "file_identity": {
          "resolved_path": "/usr/local/bin/codex",
          "device": 1,
          "inode": 2,
          "sha256": "eeeeeeeeeeeeeeeeeeeeeeeeeeeeeeeeeeeeeeeeeeeeeeeeeeeeeeeeeeeeeeee"
        },
        "sha256": "eeeeeeeeeeeeeeeeeeeeeeeeeeeeeeeeeeeeeeeeeeeeeeeeeeeeeeeeeeeeeeee",
        "capability_result": {
          "compatibility_verdict": "unverified",
          "schema_bundle_sha256": "ffffffffffffffffffffffffffffffffffffffffffffffffffffffffffffffff",
          "launch_contract_sha256": "1111111111111111111111111111111111111111111111111111111111111111"
        }
      },
      "result_artifact_ref": "018f0000-0000-7000-8000-000000000013"
    },
    "verdict": {
      "summary": "The criterion is satisfied by the captured candidate.",
      "findings": [],
      "criterion_assessments": [
        {
          "criterion_id": "C-1",
          "status": "met",
          "explanation": "Stable instructions contain Role behavior only.",
          "evidence": [
            {
              "basis": "candidate",
              "description": "The runtime plan uses the fixed Role snapshot.",
              "path": "src/specialist.rs",
              "line_start": 100,
              "line_end": 110,
              "context_id": null
            }
          ],
          "remaining_gap": null
        }
      ],
      "evidence_limits": [
        "Static inspection did not execute live Codex."
      ],
      "overall_assessment": "requirements_met"
    },
    "engagement": {
      "id": "018f0000-0000-7000-8000-000000000010",
      "state": "closed"
    },
    "settlement": {
      "schema": "dolgorae-review-target-settlement-result/v1",
      "capture_ref": "018f0000-0000-7000-8000-000000000011",
      "capture_revision": 2,
      "state": "settled",
      "source_bytes_removed": true,
      "replay": false,
      "receipt_digest": "2222222222222222222222222222222222222222222222222222222222222222"
    },
    "capture_time_source_identity": {
      "workspace_id": "workspace-1",
      "resolved_base": "aaaaaaaaaaaaaaaaaaaaaaaaaaaaaaaaaaaaaaaa",
      "resolved_head": "bbbbbbbbbbbbbbbbbbbbbbbbbbbbbbbbbbbbbbbb",
      "manifest_digest": "cccccccccccccccccccccccccccccccccccccccccccccccccccccccccccccccc",
      "whole_target_digest": "dddddddddddddddddddddddddddddddddddddddddddddddddddddddddddddddd"
    },
    "workflow_issued_source_mutation": false
  },
  "report": {
    "artifact_id": "018f0000-0000-7000-8000-000000000013",
    "verdict": {
      "summary": "The criterion is satisfied by the captured candidate.",
      "findings": [],
      "criterion_assessments": [
        {
          "criterion_id": "C-1",
          "status": "met",
          "explanation": "Stable instructions contain Role behavior only.",
          "evidence": [
            {
              "basis": "candidate",
              "description": "The runtime plan uses the fixed Role snapshot.",
              "path": "src/specialist.rs",
              "line_start": 100,
              "line_end": 110,
              "context_id": null
            }
          ],
          "remaining_gap": null
        }
      ],
      "evidence_limits": [
        "Static inspection did not execute live Codex."
      ],
      "overall_assessment": "requirements_met"
    }
  },
  "safe_error_code": null,
  "diagnostic": null,
  "engagement": {
    "engagement_id": "018f0000-0000-7000-8000-000000000010",
    "state": "closed"
  },
  "reviewer": {
    "run_id": "018f0000-0000-7000-8000-000000000012",
    "state": "closed"
  },
  "task": {
    "task_id": "018f0000-0000-7000-8000-000000058002",
    "state": "delivered"
  },
  "capture": {
    "capture_ref": "018f0000-0000-7000-8000-000000000011",
    "revision": 2,
    "state": "settled",
    "cleanup_pending": false
  },
  "server": {
    "status": "retired",
    "server_key": "bbbbbbbbbbbbbbbbbbbbbbbbbbbbbbbbbbbbbbbbbbbbbbbbbbbbbbbbbbbbbbbb",
    "server_epoch": 1,
    "epoch_id": "018f0000-0000-7000-8000-000000058003",
    "reason": null
  },
  "recovery": {
    "status": "not_needed",
    "blocked_reasons": []
  }
}
